{
    "$schema": "https://json-schema.org/draft/2020-12/schema",
    "$id": "problem_instance.schema.0.0.1.json",
    "title": "Quantum Benchmarking Problem Instance File Schema",
    "description": "Describes required fields for a valid problem instance file.",
    "required": [
        "problem_instance_uuid",
        "short_name",
        "creation_timestamp",
        "calendar_due_date",
        "contact_info",
        "problem_type",
        "instance_data",
        "status",
        "superseded_by",
        "application_domain",
        "license",
        "$schema"
    ],
    "properties": {
        "$schema": {
            "title": "Schema URI",
            "desription": "A hyperlink to the schema that describes this JSON object.",
            "type": "string"
        },
        "references":{
            "title": "References",
            "description": "A list of citations or references for the problem instance or data.",
            "type": "array"
        },
        "problem_instance_uuid": {
            "title": "Problem Instance UUID",
            "description": "Universally Unique Identifier (UUID) as a string in RFC4122 8-4-4-4-12 format.",
            "type": "string",
            "format": "uuid",
            "pattern": "^[0-9a-f]{8}-[0-9a-f]{4}-[0-9a-f]{4}-[0-9a-f]{4}-[0-9a-f]{12}$"
        },
        "creation_timestamp": {
            "title": "Creation Timestamp",
            "description": "Timestamp in ISO 8601 format.",
            "type": "string",
            "format": "date-time"
        },
        "calendar_due_date": {
            "title": "Calendar Due Date",
            "description": "For competitions and ad hoc evaluations this may be set so that the benchmark performer must return a solution by the UTC due date.  The value is a string with a timestamp in ISO 8601 format.\n\n If there is no due date, it is set to `null`.",
            "oneOf": [
                {
                    "description": "Timestamp in ISO 8601 format",
                    "type": "string",
                    "format": "date-time"
                },
                {
                    "type": "null"
                }
            ]
        },
        "short_name": {
            "title": "Short Name",
            "description": "A short string.  Not necessarily unique.",
            "type": "string"
        },
        "license":{
            "title": "License",
            "description": "object",
            "required": [
                "name",
                "url"
            ],
            "properties":{
                "name": {
                    "title": "Name of License",
                    "type": "string"
                },
                "url": {
                    "title": "URL for License",
                    "type": "string"
                }
            }
        },
        "contact_info": {
            "title": "Point of Contact(s)",
            "description": "A list of name/email/institution objects. Email is optional.",
            "type": "array",
            "items": {
                "type": "object",
                "required": [
                    "name",
                    "institution"
                ],
                "properties": {
                    "name": {
                        "title": "Name",
                        "type": "string"
                    },
                    "email": {
                        "title": "Email",
                        "type": "string"
                    },
                    "institution": {
                        "title": "Institution/Organization",
                        "type": "string"
                    },
                    "other_info": {
                        "title": "Other Information",
                        "description": "An optional object with no required structure for the test performer to put other contact information or comments in.",
                        "type": "object"
                    }
                }
            }
        },
        "status": {
            "title": "Status of the Test Procedure",
            "description": "may be 'in_force', 'in_development', 'deprecated'.",
            "type": "string",
            "enum": [
                "in_force",
                "in_development",
                "deprecated"
            ]
        },
        "superseded_by": {
            "title": "Successor Test Procedure",
            "description": "If this problem instance is status:deprecated, this field lists the UUID of the successor test_procedure object.\nIf this test_procedure is NOT deprecated, then the value is set to null.",
            "oneOf": [
                {
                    "type": "string",
                    "format": "uuid",
                    "pattern": "^[0-9a-f]{8}-[0-9a-f]{4}-[0-9a-f]{4}-[0-9a-f]{4}-[0-9a-f]{12}$"
                },
                {
                    "type": "null"
                }
            ]
        },
        "problem_type": {
            "title": "Problem Type",
            "description": "Choose from the following:\n\nGSEE\nQUANTUM_DYNAMICS\nDIFFERENTIAL_EQUATIONS\nOTHER",
            "type": "string",
            "enum": [
                "GSEE",
                "QUANTUM_DYNAMICS",
                "DIFFERENTIAL_EQUATIONS",
                "OTHER"
            ]
        },
        "application_domain": {
            "title": "Application Domain",
            "description": "Domain of the Problem Instance.  Choose from the following:\n\nCM: Condense Matter\nQC: Quantum Chemistry\nQB: Quantum Biochemistry\nBIO: Biology/Biomedical\nENG: Engineering\nFLP: Fluids/Plasmas\nOPT: Optimization\nDML: Data and Machine Learning\nHEP: High-Energy and Fundamental Physics",
            "type": "string",
            "enum": [
                "CM",
                "QC",
                "QB",
                "BIO",
                "ENG",
                "FLP",
                "OPT",
                "DML",
                "HEP"
            ]
        },
        "instance_data": {
            "title": "Instance Data",
            "description": "A list of objects describing the required data.  Exact structure is TDB.  For large instances, a URL to the data is given.",
            "type": "array",
            "items": {
                "type": "object",
                "required":[
                    "instance_data_object_uuid",
                    "instance_data_object_url",
                    "instance_data_checksum_type",
                    "instance_data_checksum",
                    "requirements"
                ],
                "optional":[
                    "independent_parameters",
                    "features",
                    "scf_solution_data"
                ],
                "properties":{
                    "instance_data_object_uuid":{
                        "title":"Instance Data Object UUID",
                        "description": "Universally Unique Identifier (UUID) as a string in RFC4122 8-4-4-4-12 format.",
                        "type": "string",
                        "format": "uuid",
                        "pattern": "^[0-9a-f]{8}-[0-9a-f]{4}-[0-9a-f]{4}-[0-9a-f]{4}-[0-9a-f]{12}$"
                    },
                    "instance_data_object_url":{
                        "title":"Instance Data Object URL",
                        "type":"string",
                        "description":"TODO: description"
                    },
                    "instance_data_checksum_type":{
                        "title": "Instance Data Checksum Type",
                        "description": "One of \n\n`sha1sum`\n`sha256sum`\n`md5sum`",
                        "type": "string",
                        "enum": [
                            "sha1sum",
                            "sha256sum",
                            "md5sum"
                        ]
                    },
                    "instance_data_checksum":{
                        "title":"Instance Data Checksum String",
                        "description":"a string containing the checksum of the data file.",
                        "type":"string"
                    },
                    "requirements":{
                        "title":"Performance Requirements",
                        "description":"an object containing the accuracy, precision and runtime requirements for the benchmark.",
                        "type":"object"                        
                    },
                    "independent_parameters":{
                        "title":"Independent Parameters",
                        "description":"[OPTIONAL] A list of parameters that are being varied over the family of Hamiltonians.",
                        "type":"object"
                    },
                    "features":{
                        "title":"Features of the Instance",
                        "description":"[OPTIONAL] Supplemental information about the problem features that drive the construction of the Hamiltonian.  TODO: we may define this structure more.",
                        "type":"object"
                    },
                    "scf_solution_data":{
                        "title": "SCF Solution File",
                        "description":"[OPTIONAL] Supplemental SCF solution file that underlies the Hamiltonian, including a UUID, URL, and parameters",
                        "type":"object"
                    }
                }
            }
        },
        "instance_features": {
            "title": "Instance Features",
            "description": "An object describing the features of the instance. E.g., basis set used for Hamiltonian creation, number of orbitals, etc.  Exact structure is TBD.",
            "type": "object"
        }
    }
}
